종류,규칙,답변
질병,렙토스피라감염증|렙토스피라," 증상] : 증상으로 불현성형, 출혈형, 황달형 등의 세 타입으로 나눌 수 있다. 대부분의 경우는 불현성형으로, 증상이 나타나지 않고 어느새 치유되어 있다. 하지만 회복한 개는 일정 기간 다른 개나 사람에 대한 감염원이 된다. 출혈형은 1~2일 발열한 후 입이나 눈의 점막이 충혈되고 구토하거나 설사를 하다 탈수증상을 일으킨다. 신장장애를 일으키기도 하며 사망률이 높은 타입이다. 황달형은 간장장애를 일으키고 점막이나 피부가 노랗게 되는 황달이 일어나고 혈뇨도 보인다. 갑자기 고열이 나고 구토하며 쇠약해지는 등으로 높은 사망률을 나타낸다.@ 원인] : 렙토스피라라는 세균에 감염된 개의 소변을 통해 오염된 땅이나 물, 음식을 입에 대면 감염되는 경우가 많으며 상처를 통해 세균이 침입하는 경우도 있다. 이 세균은 다른 동물에게도 감염되기 때문에 쥐 등을 통해 퍼지는 경우가 많다.@ 케어방법] : 항생물질을 투여하는 외에 신장이나 간장장애를 치료한다. 습도가 높은 환경에서 쉽게 발생하므로 청결이나 위생에 신경 쓰도록 한다. 사람에게 감염될 우려가 있으므로 간호 후에는 소독을 충분히 하도록 한다. 이 질병은 백신으로 예방할 수 있다."
질병,브루셀라증|브루셀라," 증상] : 감염되어도 생식기 이외에는 거의 증상이 나타나지 않는다. 수컷의 경우에는 정소(고환)가 붓거나 위축되고 정상적인 정자를 생산하지 못하여 불임의 원인이 된다. 암컷이 감염된 경우에는 사산, 유산에 이른다. 또한 며칠에서 몇 주에 걸쳐 녹색을 띤 분비물이 계속 나온다.@ 원인] : 호흡기, 소화기, 생식기 등의 점막에 브루셀라속의 세균이 감염된다. 주로 교배에 의해 발생하는데 개가 많이 모여 있는 곳에서도 감염되기 쉬운 질병이다.@ 케어방법] : 효과적인 치료법은 없고 항생물질을 장기간 투여한다. 완전히 치유되지 않는 한 유산을 반복한다. 사람에게 감염되므로 유산한 경우에는 혈액이나 태아, 분비물을 만지지 않도록 주의한다."
질병,파상풍," 증상] : 잠복 기간은 4일~2주 정도이고, 얼굴 측면의 교근(저작근의 하나)이 당기는 듯한 경련을 일으킨다. 그래서 입도 벌릴 수 없고 음식도 씹지 못하게 된다. 계속해서 온몸이 경직되고 경련을 일으킨다. 빛이나 소리, 진동 등의 자극에 예민해지고 강한 반응을 나타내는 것도 특징이다. 곧 호흡곤란을 일으키고 대부분은 사망한다.@ 원인] : 파상풍균은 널리 분포하며 흙 속에 오랫동안 살아 있다. 개가 흙에서 놀 때 입으로 들어가면 증식해서 독소를 발생시키고 신경을 침범하면서 발병한다.@ 케어방법] : 독소를 중화시키기 위한 주사나 항생물질을 투여한다. 경련이나 호흡곤란 등을 완화시키기 위한 치료도 실시한다."
질병,회충증," 증상] : 기생충의 수가 적을 때에는 거의 증상이 나타나지 않지만, 새끼의 경우 기생충이 많을 때는 배가 붓고 빈혈이나 구토, 설사를 일으킨다. 회충 덩어리가 뭉쳐 장폐색을 일으키거나 경련이나 마비 등의 신경증상이 보이기도 한다. 성견에게 기생한 경우에도 식욕이 사라지고 구토, 설사 등의 증상이 보인다. 털의 윤기가 나빠지고 몸이 마른다.@ 원인] : 감염된 개가 배설한 변 속의 기생충 알을 핥거나 먹으면 감염된다. 또 암컷이 감염된 경우 기생충은 임신 중인 상태에서 태반을 통해 태아에 감염된다. 태어난 후에도 모유를 통해 감염되기도 한다. 체내에 들어간 알은 소장에서 자충이 된다. 개회충은 혈류 등을 타고 체내로 이행하여 최종적으로는 장에 기생한다. 또 여러 장기에 자충 상태로 머무르는 타입도 있다. 어미를 통해 새끼에게 감염되는 것은 개회충 쪽이다. 개소회충은 체내를 이행하지 않고 장 속에서 성장한다.@ 케어방법] : 구충약을 투여하고 항생제 등으로 체력회복을 도모한다. 배변 후에는 변을 즉시 처리하는 등 위생에 신경 쓰는 것이 예방이 된다. 드물지만 사람이 감염되는 경우도 있으므로 특히 아이가 있는 집에서는 주의가 필요하다."
질병,구충증," 증상] : 통상 1세 이하의 자견에게 발병한다. 설사를 하고 타르 모양의 변이나 혈변을 보기도 한다. 빈혈을 일으키고 심해지면 눈의 결막이나 입의 점막이 하얘지며 통증이 있기 때문에 배를 감싸는 듯한 자세를 취한다. 모유로 감염된 갓 태어난 새끼는 젖을 먹지 못하게 되어 급격히 쇠약해지고 빈혈로 쇼크사를 일으키기도 한다. 증상이 가벼운 경우 설사를 하는 일이 만성적으로 일어나며 건강하지 못한 상태가 된다.@ 원인] : 변과 함께 배설된 알이 부화하여 자충 상태로 음식물이나 식기에 붙어서 코와 입으로 감염된다. 구충의 자충은 흙 속에서 생식하기 때문에 개의 피부나 모공으로 감염되기도 한다. 또 암컷이 감염되면 태반이나 모유를 통해 새끼에게 감염된다. 자충은 최종적으로 장에 도달해 성충이 된다.@ 케어방법] : 증상이 가벼우면 약이나 주사로 구충을 하지만, 쇼크 상태를 일으키는 경우에는 수혈 등의 구급처치가 필요하다. 평소의 위생관리가 중요한 만큼 변은 빨리 처리하고 청결을 유지한다."
질병,편충증," 증상] : 소수가 기생하는 것만으로는 증상이 나타나지 않지만 다수가 기생하면 배에 통증이 나타나고 항상 설사를 하게 되며 선명한 혈변을 볼 수도 있다. 식욕이 없어져 영양불량이 되고 털의 윤기도 나빠지며 점점 마른다. 빈혈이나 탈수증상을 일으키기도 한다.@ 원인] : 변과 함께 배설된 알이 음식물이나 식기에 붙어서 입으로 들어가 감염된다. 회충이나 구충과 달리 경구감염만 된다. 체내에 들어간 알은 주로 소장 안에서 부화하여 맹장 또는 결장에 기생한다.@ 케어방법] : 약이나 주사로 구충한다. 빈혈이나 탈수 증상이 있다면 수혈 등을 맞힌다. 다른 기생충 예방과 마찬가지로 변을 빨리 처리하여 위생을 유지함으로써 예방이 가능하다. 편충의 알은 저항성이 있고, 흙 속에서 5년 이상 생존하므로 실외 생활을 하는 개가 편충기생의 병력이 있다면 개집을 이동시키거나 흙을 바꿔줄 필요가 있다."
질병,조충증," 증상] : 약 1cm 정도의 기생충의 체절이 찢어져 배설되는데 항문 주변에 붙은 채 말라서 부서진다. 이로 인해 항문이 자극을 받기 때문에 엉덩이를 땅에 문지르거나 핥게 된다. 대부분의 경우 증상이 나타나는 일은 별로 없지만, 다수 기생하면 설사나 식욕부진을 보이고 영양불량이 된다.@ 원인] : 항문 주변에 달라붙은 체절은 말라서 부서지면 안의 알이 흩어진다. 벼룩이 알을 먹으면 벼룩의 몸속에서 기생충이 발육한다. 개가 적극적으로 벼룩을 먹지는 않지만 우발적으로 삼켰을 때 감염된다.@ 케어방법] : 약이나 주사로 구충하고 영양불량이 됐을 때에는 영양제 등을 투여한다. 중간 숙주가 되는 벼룩을 구제하는 것이 가장 효과적인 예방법이므로 벼룩 구제약이나 샴푸를 이용해 벼룩을 퇴치한다. 개와 개집도 모두 청결하도록 신경 써야 한다."
질병,콕시듐, 증상] : 특히 유견이 걸리기 쉬운데 설사를 반복하고 점액상의 변이나 혈변을 본다. 설사를 하기 때문에 탈수증상이나 빈혈을 일으키며 쇠약하다. 성견이 발병하는 경우는 거의 없다.@ 원인] : 현미경으로밖에 보이지 않는 작은 콕시듐 원충이 경구 감염되어 장세포로 파고들어가 증식하여 점막을 손상시키면서 발생한다.@ 케어방법] : 일반적으로 술파제라는 약을 투여하여 치료한다. 탈수나 빈혈이 심한 유견에게는 수액이나 수혈 등이 필요할 수도 있다. 변과 함께 배설된 직후의 미숙한 원충은 감염력이 없기 때문에 변을 빨리 처리하면 재감염을 방지할 수 있다.
질병,편모충증|편모충," 증상] : 물기 있는 설사나 지방분이 많은 노란색 설사가 된다. 펫샵 등 다수 사육되는 장소에서 집단 발생하는 일이 많다.@ 원인] : 오염된 변이나 음식물, 물 등을 통해 원충이 입으로 들어와 소장에 기생하여 설사가 일어난다.@ 케어방법] : 구충약을 투여한다. 재감염을 방지하기 위해 변은 바로바로 치우고 소독하듯이 처리한다."
질병,아토피성피부염," 증상] : 얼굴이나 다리 안쪽의 피부가 겹치는 부위, 배 등에 심하게 가려움증이 있고 자주 핥거나 물기 때문에 피부가 상처 입어 문드러지며 만성화되면 두꺼워져서 건조해지고 거뭇해진다. 외이염이나 결막염, 비염을 동반하는 경우도 많으며, 일단 치료해도 자주 재발하는 질병이다. 골든 리트리버나 시바견 등의 견종은 선천적으로 이 질병에 걸리기 쉽다.@ 원인] : 꽃가루나 먼지, 벼룩 외에 담배, 고양이 비듬 등 공중에 떠다니는 알레르겐을 흡입하면서 발생한다. 피부에 부착되면서 발생하는 경우도 있다. 알레르기는 해가 있는 것이 몸에 침입했을 때 그것을 제거하기 위해서 공격하는 면역기능이 평소에는 해가 없는 것에 대해서 과도하게 작용함으로써 일어난다.@ 케어방법] : 치료는 가려움을 멎게 하는 약 투여를 중심으로 한다. 부신피질 호르몬 약은 효과적이지만 부작용이 크기 때문에 반드시 수의사의 지시에 따라 사용한다. 가정에서는 원인이 되는 진드기나 먼지를 줄이도록 부지런히 청소할 필요가 있다. 달라붙어 있는 알레르겐을 샴푸로 떨어뜨리는 것도 가정에서 할 수 있는 효과적인 치료법이다. 그 경우에는 피부가 너무 건조해지지 않도록 보습효과가 있는 것을 선택해야 한다. 샴푸에는 다양한 종류가 있으므로 수의사에게 상담한다."
질병,벼룩알레르기성피부염|벼룩," 증상] : 심한 가려움이, 특히 등줄기를 따라 허리나 꼬리가 난 부분 등 하반신을 중심으로 발견된다. 알레르기이기 때문에 가려움은 벼룩에 물린 곳과는 관계없이 나타난다. 피부는 염증을 일으켜 빨개지고, 털이 빠지기도 한다. 개가 핥거나 긁어서 염증이 악화되고 벼룩을 구제해도 한 달 정도는 증상이 계속된다.@ 원인] : 벼룩에게 물리거나 피부 표면을 돌아다니는 자극에 의해 일어나는 피부염도 있지만, 이 알레르기는 벼룩의 타액에 대해 몸이 예민하게 반응해서 일어나므로 벼룩의 수와는 상관없이 발병한다.@ 케어방법] : 알레르기에 대해서는 부신피질 호르몬 등을 투여한다. 벼룩의 구제는 다양한 종류가 있으므로 개의 상태와 사육환경을 고려하여 적절한 것을 선택한다. 반복적으로 발병하는 경우도 많으므로 병원에서 지속성이 있는 적하형 벼룩살충제를 처방받거나 가정에서는 청소를 자주 하는 등 벼룩 발생을 방지하는 것도 중요하다."
질병,음식물알레르기," 증상] : 먹은 지 얼마 지나지 않아 증상이 나타난다. 심해지면 온몸에 피부염이 번지는 경우도 있지만 일반적으로는 눈이나 입 주변을 가려워하는 경우가 많고, 열이 나거나 설사나 구토를 동반하는 경우도 있다.@ 원인] : 우유나 육류, 곡물, 과일 등의 예가 많이 보이듯 특정 음식물이 원인이 될 수 있다. 2세 전후의 개에게 많이 발병되는 듯하다.@ 케어방법] : 혈액검사로 알레르기 원인(알레르겐)을 특정할 수 있다. 2~10주에 걸쳐서 원인으로 생각되는 음식물을 제거하면서 증상을 살펴보고 원인을 특정하는 방법도 있다. 약으로는 별로 효과가 나타나지 않기 때문에 원인이 되는 음식을 찾아내어 급여하지 않는 것이 가장 좋은 방법이다."
질병,접촉성피부염," 증상] : 접촉한 부분이 빨갛게 듬성듬성 발진하거나 가렵고 탈모 등이 일어난다. 목이나 입 주변, 흉부나 다리 등 털이 없는 부분에 번지는 경우가 많고, 식기나 장난감에 반응한 경우는 코나 입에 증상이 많이 나타난다.@ 원인] : 목걸이나 플라스틱 식기, 샴푸, 세제, 바닥의 왁스류, 카펫, 나일론, 검, 살충제, 소취제 등 다양한 물품이 원인이 된다.@ 케어방법] : 잘 관찰해서 원인이 되는 물건을 알아내어 사용을 중지한다."
질병,지루증," 증상] : 가슴이나 등줄기, 겨드랑이 아래, 귀속 등 피지 분비가 많은 부분이 기름지고 끈적거리는 피부나 또는 버석버석 건조하고 비듬이 많은 피부가 된다. 몸은 특유의 심한 냄새가 나게 되고 탈모가 일어나는 경우도 있다. 증상이 진행되면 가려움도 생기고 세균이나 마라세티아에 감염되는 경우가 많다.@ 원인] : 정상이라면 3주 정도 걸리는 피부의 각질화 사이클이 매우 빨라져 피부가 지루화된다. 또 피부의 윤기에 중요한 피지샘에 이상이 생겨 발생하는 경우도 있다. 호르몬의 이상이나 영양불균형, 피부기생충이나 세균감염, 알레르기 등 원인은 다양하다.@ 케어방법] : 각질을 녹이는 샴푸 등으로 피부의 컨디션을 조절한다. 다른 질환이 원인인 경우는 그것부터 치료해야 한다. 좀처럼 낫지 않고 만성화되는 경우가 많은 피부병이다. 평소 식사의 영양 밸런스에 신경 쓰고 체질 개선을 도모하며 피부를 청결하게 유지하는 것이 중요하다."
질병,농피증," 증상] : 피부가 빨갛게 되고 표면에 우둘투둘한 부스럼이 생기거나 액체나 고름이 고인 수포나 농포가 생기는 경우도 있다. 감염은 피부 표면에서 일어난 경우라고 해도 심한 가려움을 동반하며, 진피 피부층에서 일어났다면 심한 통증과 함께 열이 나기도 한다. 이 경우 심하게 긁거나 핥는 행동을 반복하여 환부가 탈모를 일으키는 경우가 많다.@ 원인] : 감염시키는 것은 주로 포도구균이라고 하는 세균이다. 간단한 소독 정도로 낫는 경우도 많지만, 몸의 저항력이 떨어져 있거나 면역력이 저하되어 있어 케어가 되지 않으면 피부를 화농화시킨다.@ 케어방법] : 증상을 보면서 항생물질이나 항균제를 투여하고 세균의 증식을 억제한다. 만성화된 경우에는 약의 투여가 장기화되기도 한다. 가정에서는 약용 샴푸 등을 사용하고, 빗질로 몸을 청결하게 유지하도록 신경 쓰자. 증상이 나타나면 고온이나 다습한 환경은 피해야 한다."
질병,모낭충증," 증상] : 1세 미만의 자견에게 흔히 발생한다. 초기에는 눈, 코, 입 주변이나 발끝 등의 털이 빠지는데, 가려움이나 발진도 가볍기 때문에 그냥 지나치기 쉽다. 하지만 탈모가 서서히 번지면 온몸에 퍼지게 된다. 세균에 의한 2차 감염이 일어나면 화농, 출혈, 짓무름이 나타나며 가려움도 심해지기 때문에 개가 긁어대거나 핥으면 증상이 더욱 악화된다. 노견이 걸리는 경우도 증가하고 있는데, 이 경우에는 내분비의 질환이나 면역계의 이상 우려가 있다.@ 원인] : 보통의 건강상태라면 발병하지 않지만 면역력이나 저항력이 저하되거나 영양상태가 나쁘면 모공의 바리어 기능이 작용하지 못하고 진드기가 폭발적으로 증식하여 발생하는 것으로 보인다.@ 케어방법] : 진드기를 구제하는 약에는 다양한 종류가 있는데 어느 것이든 장기간에 걸친 치료가 필요하다. 약용샴푸를 사용하거나 털을 깎는 경우도 있다. 면역력을 높이는 대책이 필요하며, 식사나 보조제로 커버할 수 있는 부분도 있으므로 수의사의 지시에 따르도록 한다."
질병,개선충증," 증상] : 특히 팔꿈치나 발꿈치, 귀 등에 탈모나 염증이 발생해 피부가 딱딱해지고 비듬이 발생한다. 매우 가려워하고 밤낮없이 긁어댄다. 질병이 진행되면 부스럼이 생기고 그 밑에서 옴벌레가 번식한다. 심해지면 온몸에 피부염이 번진다.@ 원인] : 개의 피부에 구멍을 뚫어 침입한 진드기가 그 속에 산란하거나 배설하면서 평생을 보내기 때문이다.@ 케어방법] : 진드기 구제약을 투여한다. 구제약이 진드기 알에는 효과가 없기 때문에 1주일 정도 간격을 두고 투여를 반복해야 한다. 전신의 털을 깎는 경우도 있다. 전염력이 강하기 때문에 병에 걸린 개에게 접촉한 동물은 검사를 하는 것이 좋다."
질병,피부사상균증, 증상] : 가려움이 나타나는 경우는 거의 없지만 10원짜리 동전만한 원형 탈모가 생기는 것이 특징이다. 심해지면 탈모 부분이 커지고 비듬이 생기거나 부스럼이 되기도 한다.@ 원인] : 곰팡이의 일종인 피부사상균에 감염되어 발병한다. 약한 표피에서 증식하고 부분적으로 염증을 일으킨다.@ 케어방법] : 연고를 바르거나 내복약을 투여한다. 털을 깎고 약용샴푸로 씻기도 한다. 화장실 매트 등을 통해 사람에게 옮을 수 있으니 주의해야 한다. 청소나 소독을 부지런히 하고 개를 만진 후에는 손을 씻는다.
질병,마라세티아감염증|마라세티아," 증상] : 마라세티아에 의한 외이염에서는 머리를 흔들거나 귀를 긁는 등 전형적인 외이염 증상을 보인다. 귀지가 대량으로 나오거나 초콜릿색이 되고 신 냄새 같은 것이 난다. 피부에서는 겨드랑이나 다리 안쪽의 겹치는 부위, 발가락 사이, 음부 등에 염증이 일어난다. 빨개지거나 건조해지거나 끈적거리거나 심한 가려움이 나타난다.@ 원인] : 마라세티아는 통상적으로도 피부나 귀에서 보이는 미생물인데, 알레르기나 염증, 지방분이 많은 식사 등으로 피지가 많아지면 과도하게 증식하게 된다. 특히 고온다습하고 귀지 등이 영양분이 되는 귓속은 번식하기 쉬운 장소이다.@ 케어방법] : 항진균 약을 투여하거나 바르는 외에 약용샴푸로 세정한다. 피부나 환경을 청결하게 유지한다."
질병,자기면역에의한피부병," 증상] : 대부분 천포창이라는 피부병 증상을 보인다. 입안이나 눈 주변이나 항문 주변 등에 심한 가려움증을 동반한 염증이나 탈모가 일어난다. 또 손가락 사이나 발 패드, 귀, 코 등에 염증이 일어나고 딱지나 탈모가 발생하는 타입도 있다. 천포창 외에 자기면역성 피부병으로 수포성류 천포창, 홍반성 낭창(Erythematodes)이 알려져 있는데 수포성류 천포창은 발열이나 탈수 등이, 홍반성 낭창은 발열, 신장장애, 빈혈 등의 전신증상을 일으킨다.@ 원인] : 모종의 이유로 면역이 피부 세포를 공격해서 일어난다. 원인으로 자외선, 감염, 알레르기, 유전적 요소 등을 생각할 수 있지만 확실한 것은 알려져 있지 않다.@ 케어방법] : 몇 가지 약을 조합해서 투여한다. 일반적으로 피부병 치료에는 끈기가 필요한데, 자기면역성인 질병은 특히 장기요양을 해야 한다. 자기면역력의 밸런스를 조절하도록 피부를 청결하게 유지하고 최대한 자극을 받지 않기 위해서는 직사광선을 피하거나 기생충을 구제하는 등의 주의가 필요하다."
질병,내분비성피부병," 증상] : 호르몬이 분비되는 위치에 따라 증상이 다양한데 피부에 좌우대칭으로 발생하는 탈모 증상이 특징이다. 부신피질 호르몬이나 성장 호르몬의 이상으로는 동체를 중심으로 넓게 탈모되고, 성호르몬에서는 생식기나 항문 부근의 탈모가 발견된다. 가장 많은 갑상선 호르몬의 이상으로는 동체의 탈모가 많은데, 대형견은 다리털이 빠지는 경우도 있다. 어느 것이든 다른 장기에까지 영향을 미치기 때문에 다양한 증상이 나타난다.@ 원인] : 호르몬 분비량의 과잉이나 부족에 의해서 발생한다. 호르몬이 털의 근원에 있는 모포에 영향을 미치기 때문에 탈모가 일어난다.@ 케어방법] : 혈액 속의 호르몬 양을 계측할 수 있으므로 그 결과에 따라 호르몬을 보급하거나 너무 많은 경우에는 제어하는 치료를 하며, 대체로 장기간에 걸쳐 이루어진다."
질병,피부종양," 증상] : 피부나 피하에 멍울이 느껴진다. 종양이 커지거나 수가 많아지는 경우에는 내장으로 전이될 위험성이 증대한다. 궤양이나 외상과 구별하기 어려운 경우도 많으므로 주의가 필요하다. 악성 편평상피암은 털이 빠지고 궤양이 되거나 부스럼이나 피부병 또는 상처처럼 보인다. 두부나 복부, 회음부에 잘 발생한다. 선암은 귀나 항문에 잘 발생한다. 단기간에 커지거나 림프관이나 혈관을 통해 전이되기도 쉬운 암이다. 비만세포종 또한 전이되기 쉬운 악성암으로, 하반신에 많이 발생하고 나이를 먹을수록 발생 빈도가 높아진다. 종양이 생긴 부분의 피부는 부풀어 올라 혹처럼 되거나 피부가 괴사하기도 하지만 단순한 사마귀와 구별이 되지 않는 경우도 있다.@ 원인] : 유전적인 요인 외에 자외선 등도 원인이 된다.@ 케어방법] : 외과수술에 의한 절제가 일반적이다. 방사선 치료나 항암제의 투여가 실시되는 경우도 있다. 조기발견이 중요하다. 피부암은 몸의 표면을 쓰다듬어서 멍울이 없는지 확인하면 발견할 수 있다. 또 피부병이나 상처와 구별하기 어려운 경우도 많이 있으므로 주의해야 한다."
질병,안검내반외반," 증상] : 내반은 속눈썹이 눈의 표면을 찌르기 때문에 항상 아프고 눈물이 많이 나게 된다. 외반은 결막염이나 유루증의 원인이 되는 경우가 많고 눈곱이 많이 나온다. 개는 눈에 문제가 있는 듯 자꾸 신경 쓰는 행동을 하게 된다.@ 원인] : 선천적인 이상으로 일어나는 경우가 많은 질환인데, 눈 주변의 상처나 질병의 통증 때문에 눈꺼풀이 경련해서 일어나는 경우나 노령으로 안륜근이 약해져서 일어나는 경우 등도 있다.@ 케어방법] : 결막염 등의 질환을 병발하는 경우가 많기 때문에 일단 그 질환부터 치료한다. 그 후 속눈썹을 뽑거나 연고를 발라서 대응한다. 내반, 외반 모두 중증인 경우에는 수술로 치료하는 것이 일반적이다."
질병,속눈썹이상," 증상] : 속눈썹이 결막에서 돋아나 각막 쪽으로 향해 있는 이소성 첩모, 눈꺼풀의 테두리에서 돋아나 각막에 접촉하는 첩모중생, 돋아난 장소는 정상이지만 각막을 향해 돋아난 첩모난생 등이 있다. 모두 다 방치하면 각막염이나 각막궤양의 원인이 되므로 치료가 필요하다.@ 원인] : 일시적인 역행성 눈썹 등과 달리 선천적으로 눈썹이 이상한 상태로 나는 질병이다.@ 케어방법] : 이상하게 난 속눈썹을 뽑는 치료의 경우 정기적으로 계속 뽑아주어야 한다. 레이저수술 등으로 모근을 태우는 방법도 있다."
질병,유루증," 증상] : 눈물이 계속 흐르기 때문에 눈에서 코를 따라 털이 적갈색으로 변색된다. 눈꺼풀에 염증이 생기는 경우도 있다.@ 원인] : 눈물이 많이 분비되거나 눈자위에 있는 누선에서 코로 이어지는 비루관으로 배출되지 못해서 발생하는 것이다. 선천적으로 누점이나 비루관에 이상이 있는 경우나 각막염이나 결막염의 영향, 안륜근의 기능저하 등 원인은 다양하다.@ 케어방법] : 다른 질환이 원인이라면 그 병부터 치료한다. 염증인 경우에는 항생물질을 투여한다. 누점이나 누관을 세정하는 경우도 있다."
질병,체리아이," 증상] : 대부분은 양쪽 눈에 생기는데 한쪽 눈에만 생기기도 한다. 제삼안검선이 크게 부어오르기 때문에 개가 눈을 비벼서 결막염이나 각막염을 병발하는 경우가 종종 있다.@ 원인] : 비글이나 코커스파니엘, 페키니즈 등은 선천적으로 발생하기 쉬운 견종으로 알려져 있다. 외상이나 염증 등이 원인으로 발생하는 경우가 있고 개가 눈을 비비다 튀어나오는 경우도 있다.@ 케어방법] : 일반적으로 튀어나온 제삼안검을 원래 위치로 돌려놓고 봉합한다. 절제해야 하는 경우도 있다."
