종류,규칙,답변
질병,지루증이유|지루증원인,"정상이라면 3주 정도 걸리는 피부의 각질화 사이클이 매우 빨라져 피부가 지루화된다. 또 피부의 윤기에 중요한 피지샘에 이상이 생겨 발생하는 경우도 있다. 호르몬의 이상이나 영양불균형, 피부기생충이나 세균감염, 알레르기 등 원인은 다양하다."
질병,농피증이유|농피증원인,"감염시키는 것은 주로 포도구균이라고 하는 세균이다. 간단한 소독 정도로 낫는 경우도 많지만, 몸의 저항력이 떨어져 있거나 면역력이 저하되어 있어 케어가 되지 않으면 피부를 화농화시킨다."
질병,모낭충증이유|모낭충증원인,보통의 건강상태라면 발병하지 않지만 면역력이나 저항력이 저하되거나 영양상태가 나쁘면 모공의 바리어 기능이 작용하지 못하고 진드기가 폭발적으로 증식하여 발생하는 것으로 보인다.
질병,개선충증이유|개선충증원인,개의 피부에 구멍을 뚫어 침입한 진드기가 그 속에 산란하거나 배설하면서 평생을 보내기 때문이다.
질병,피부사상균증이유|피부사상균증원인,곰팡이의 일종인 피부사상균에 감염되어 발병한다. 약한 표피에서 증식하고 부분적으로 염증을 일으킨다.
질병,마라세티아감염증이유|마라세티아감염증원인,"마라세티아는 통상적으로도 피부나 귀에서 보이는 미생물인데, 알레르기나 염증, 지방분이 많은 식사 등으로 피지가 많아지면 과도하게 증식하게 된다. 특히 고온다습하고 귀지 등이 영양분이 되는 귓속은 번식하기 쉬운 장소이다."
질병,자기면역에의한피부병이유|자기면역에의한피부병원인,"모종의 이유로 면역이 피부 세포를 공격해서 일어난다. 원인으로 자외선, 감염, 알레르기, 유전적 요소 등을 생각할 수 있지만 확실한 것은 알려져 있지 않다."
질병,내분비성피부병이유|내분비성피부병원인,호르몬 분비량의 과잉이나 부족에 의해서 발생한다. 호르몬이 털의 근원에 있는 모포에 영향을 미치기 때문에 탈모가 일어난다.
질병,피부종양이유|피부종양원인,유전적인 요인 외에 자외선 등도 원인이 된다.
질병,안검내반외반이유|안검내반외반원인,"선천적인 이상으로 일어나는 경우가 많은 질환인데, 눈 주변의 상처나 질병의 통증 때문에 눈꺼풀이 경련해서 일어나는 경우나 노령으로 안륜근이 약해져서 일어나는 경우 등도 있다."
질병,속눈썹이상이유|속눈썹이상원인,일시적인 역행성 눈썹 등과 달리 선천적으로 눈썹이 이상한 상태로 나는 질병이다.
질병,유루증이유|유루증원인,"눈물이 많이 분비되거나 눈자위에 있는 누선에서 코로 이어지는 비루관으로 배출되지 못해서 발생하는 것이다. 선천적으로 누점이나 비루관에 이상이 있는 경우나 각막염이나 결막염의 영향, 안륜근의 기능저하 등 원인은 다양하다."
질병,체리아이이유|체리아이원인,"비글이나 코커스파니엘, 페키니즈 등은 선천적으로 발생하기 쉬운 견종으로 알려져 있다. 외상이나 염증 등이 원인으로 발생하는 경우가 있고 개가 눈을 비비다 튀어나오는 경우도 있다."
질병,결막염이유|결막염원인,세균이나 바이러스에 의한 감염이 일반적이며 먼지나 알레르기 등도 원인이 된다. 결막은 다른 점막보다 외부에 접할 기회가 많기 때문에 염증이 일어나기 쉽고 눈을 비비거나 털이 들어가서 발생하기도 한다.
질병,각막염이유|각막염원인,대부분 바이러스나 세균에 감염되거나 눈을 부딪치는 등의 부상 때문에 염증이 발생한다. 눈물의 양이 적은 건조증 등이 원인이 되기도 한다.
질병,포도막염이유|포도막염원인,외상이나 주위의 염증 등의 원인이 있는데 대부분은 원인이 확실하지 않다. 아키타견에게는 원전병이라는 유전병이 있는데 포도막염이나 백내장을 일으킨다.
질병,백내장이유|백내장원인,"대개는 노화에 의한 것으로 평균적으로 6세를 넘긴 시점부터 서서히 증상이 진행된다. 외상이나 당뇨병, 내분비 이상 등이 원인이 되는 경우도 있다. 약년성은 유전에 의한 것으로 보인다."
질병,녹내장이유|녹내장원인,안압이 상승하여 시신경을 압박하면서 장애가 발생한다. 유전에 의한 것이 많은데 포도막염이나 종양 등의 질병이 원인인 경우도 있다.
질병,망막박리이유|망막박리원인,"콜리 등에서는 유전에 의해 선천적으로 발행하는 일이 많다. 그 밖에는 망막과 맥락막 사이에 염증이 생겨 발병하거나, 유리체가 변형되어 일어나거나 사고 등으로 두부에 받은 충격이 원인이 되기도 한다."
질병,안구탈출이유|안구탈출원인,"머리나 몸에 강한 충격을 받으면 눈이 튀어나오게 된다. 특히 시추나 퍼그, 불독 등의 단두종은 작은 충격에도 탈출이 일어나는 일이 흔하다."
질병,이혈종이유|이혈종원인,외이염의 가려움 때문에 귀를 긁거나 머리를 세게 흔들거나 할 때 혈관이 터지면서 혈액이나 액체가 쌓여서 일어난다. 상처나 알레르기가 원인이 되어 발병하기도 한다.
질병,외이염이유|외이염원인,"외이도의 귀지에 세균이나 곰팡이 등이 번식해서 염증이 생기는 것이 일반적인데, 풀이나 곤충, 샴푸 등이 귀로 들어가거나 아토피 등의 알레르기도 원인이 된다. 귀옴벌레라는 미세한 진드기나 마라세티아라는 효모균이 원인인 경우도 있다. 화농균이 항생제로 퇴치된 후에 균교대증이 나타나 효모균이 증식하기도 한다."
질병,중이염이유|중이염원인,원인은 외이염과 거의 동일한데 외이의 염증이 번져서 일어난다. 중이의 고실까지 염증이 일어나 고름이 쌓이기도 한다.
질병,내이염이유|내이염원인,"일반적으로 외이염에서 중이염으로, 중이염에서 내이염으로 발전한다."
질병,치주질환이유|치주질환원인,입안을 불결하게 관리하면 치구가 쌓이고 곧 치석이 낀다. 치구 안에 있는 세균이 치주 질환을 일으킨다. 치구나 치석을 방치하면 치주 질환이 악화된다.
질병,치근첨주위농양이유|치근첨주위농양원인,"치주 질환이 심해져서 일어나거나, 이빨이 부러지거나 빠져서 치수가 노출되면 치근 주위가 세균에 감염되면서 일어난다."
질병,애나멜질형성부전이유|애나멜질형성부전원인|애나멜질이유|에나멜질이유|애나멜질원인|에나멜질원인,"영구치의 애나멜질이 형성되는 생후 1~4개월 무렵에 홍역 등의 감염증, 영양장애, 약물섭취 등으로 인해 충분하게 발달하지 못해서 일어난다."
질병,구내염이유|구내염원인,"개는 이물질을 씹는 버릇이 있는데 이빨 사이에 나뭇조각이나 뼛조각 등의 이물이 끼어서 발생한다. 그 밖에 약품이나 화상, 바이러스나 세균 등의 감염, 비타민 부족 등 다양한 원인을 유추할 수 있다."
질병,구강종양이유|구강종양원인,유전 외에 입안의 위생 상태나 자극도 원인이 되는 것으로 보인다.
질병,자궁축농증이유|자궁축농증원인,출산 경험이 없는 개나 한 번만 출산한 개가 걸리기 쉽다. 발정기에는 세균이 침입하기 쉽기 때문에 발정기 이후에 많이 발병한다는 특징이 있다. 감염에 대한 저항력이 약해져 있으면 세균이 번식하고 화농화가 일어난다.
질병,질탈이유|질탈원인,"분만 시의 과도한 진통이나 교배시의 충격, 변비로 인한 복압 등도 원인이 된다."
질병,난소종양이유|난소종양원인,"양성 과립막세포종 외에 선종, 선암, 난포막세포종 등이 있다. 다른 종양과 마찬가지로 유전이나 환경에 의해 일어난다."
질병,유선염이유|유선염원인,"새끼에 의해 외상이 생겼거나 위생상태가 좋지 않은 것이 원인이며, 세균에 감염되어 발생한다. 젖이 다량 분비되는 것이 원인이 되는 경우도 있다."
질병,유선종양이유|유선종양원인,최초의 발정 전인 생후 6개월령 정도 사이에 중성화 수술을 받은 경우에는 발생률이 1% 이하라는 보고가 있다. 또 수술을 받은 연령에 따라 발생률이 다르기 때문에 분명 난소의 기능이 발병에 관여하고 있는 것으로 보인다.
질병,정유정소이유|정유정소원인,유전에 의한 것으로 보인다. 굳이 따지자면 소형견에게 많이 보인다.
질병,정소종양이유|정소종양원인,다른 종양과 마찬가지로 원인은 잘 알려져 있지 않다. 양성이 대부분이다.
질병,전립선비대이유|전립선비대원인,쇠약한 정소에서 정소호르몬이 제대로 분비되지 않아 밸런스가 무너지면서 일어나는 것으로 보인다.
질병,전립선염이유|전립선염원인,요도로 침입한 대장균이나 포도구균 등의 세균이 전립선에 침입하여 감염되어 일어난다.
질병,전립선농양이유|전립선농양원인,전립선염이나 전립선 비대에 요로감염증이 추가되면서 발생하는 것으로 보인다.
질병,전립선농포이유|전립선농포원인,전립선 비대나 전립선염에 의해 전립선의 분비액이 배설되지 못하게 되기 때문에 조직 안에 공포가 생겨 분비액에 쌓이게 되어 발생한다.
질병,승모판폐쇄부전케어방법|승모판폐쇄부전주의,"나이를 먹으면서 발생하는 질병이기 때문에 완치는 불가능하다. 혈관확장제, 이뇨제, 강심제 등을 사용해 몸의 부담을 덜어준다. 조기발견, 조기치료가 장수의 비결이다. 기침이 나오거나 5살을 넘기면 검사를 받아보자. 원칙적으로 식사는 염분을 제한해야 하며, 심장병용 치료식으로 바꿔주는 것이 좋다."
질병,심근증케어방법|심근증주의,혈관확장제나 이뇨제 등으로 질병을 완화시키는 치료를 한다. 내복약은 장기적으로 복용해야 하는데 부작용을 걱정할 필요는 없다. 식이요법을 통해 질병의 진행을 억제시킨다.
질병,심장사상충증케어방법|심장사상충증주의,"모기가 발생하는 지역에서는 현재도 감염될 소지가 있는 질병이다. 심장사상충증은 예방이 가장 중요한데, 벌레가 침입해도 예방약으로 구제할 수 있기 때문이다. 모기가 나오기 1개월 전부터 모기가 사라지는 1개월 후까지 적당량의 예방약을 먹인다. 치료는 성충이 기생해서 기침이나 복수 등의 증상이 나타날 때에는 증상을 완화시키기 위한 대증요법을 하는데, 심장 등에 기생한 심장사상충의 살충치료는 부작용을 동반하는 일이 적지 않다."
질병,동맥관개존증케어방법|동맥관개존증주의,"증상을 완화시키는 치료를 한 후에, 상태가 안정되면 전문의에게 수술을 받을 수 있다."
질병,폐동맥협착증케어방법|폐동맥협착증주의,경도인 경우에는 증상을 완화시키는 치료를 하면서 상태를 살펴볼 수 있지만 심해지면 전문가에게 수술을 받아야 한다.
질병,심실심방중격결손증케어방법|심실심방중격결손증주의|심실중격결손증케어방법|심방중격결손증주의,"무증상인 경우에는 특별히 치료할 필요가 없지만, 중증인 경우에는 증상에 따른 치료를 하면 되는데 간혹 꼭 수술을 해야 하는 경우도 있다."
질병,부정맥케어방법|부정맥주의,"원인이 되는 질병을 치료한다. 증상이 가벼운 경우에는 항부정맥제 등을 쓰면 되지만, 긴급히 치료해야 하는 경우도 있다."
질병,빈혈케어방법|빈혈주의,"원인에 따라 치료 방법이 다르다. 컨디션에 따라서는 수액을 맞히고, 중증일 때에는 수혈을 받기도 한다. 용혈성 빈혈은 중독에 의해 발생하는 일도 많기 때문에 개에게 독성이 있는 음식물을 주면 안 되며, 살충제, 세제 등 관리에 신경 써야 한다."
질병,혈소판감소증케어방법|혈소판감소증주의,"완치는 불가능하지만 치료에 따라 증상을 완화시킬 수는 있다. 빈혈이 심할 때에는 수혈을 하는 것이 좋지만, 혈액형이 적합하고 혈액을 제공하는 개가 가까이 있어야만 가능하다. 치료는 장기간에 걸쳐 진행되는 경우가 종종 있다."
질병,바베시아증케어방법|바베시아증주의,빈혈이나 황달의 치료 외에 항원충제를 투여한다. 재발이 많은 질병이므로 완치시키는 것이 중요하다. 참진드기가 기생하지 않도록 정기적으로 살충제를 주변에 살포하는 것이 예방대책이다.
질병,비염케어방법|비염주의,항생물질이나 소염제를 투여한다. 원인이 어금니의 치조농루인 경우에는 그것을 치료해야 한다. 이물질에 의한 비염인 경우에는 세정하거나 제거한다. 가정에서는 냉기에 노출되지 않도록 따뜻하게 해주고 콧물이나 눈곱을 닦아 청결히 한다.
질병,부비강염케어방법|부비강염주의,비염과 마찬가지로 소염제나 항생물질을 투여한다. 심한 경우에는 튜브 등을 통해 부비강을 세정하는 방법도 있다. 코나 이빨 등의 염증은 일찌감치 치료하여 만성화하지 않도록 한다.
질병,인두염케어방법|인두염주의,항생물질이나 소염제를 투여한다. 흡입기로 치료하는 경우도 있다. 가정에서는 환기를 자주 시키고 따뜻하게 해준다.
질병,연구개과장증케어방법|연구개과장증주의,호흡곤란을 일으키는 경우에는 긴급히 산소흡입하고 소염제를 투여하여 경과를 지켜본다. 근본적으로는 내려간 연구개를 절제하는 수술이 필요하다.
질병,기관허탈케어방법|기관허탈주의,"기침을 부드럽게 하기 위한 치료나 호흡곤란, 청색증에 대한 처치를 한다. 경우에 따라서는 기관을 확장하는 정형수술이 필요하다. 가정에서는 특히 여름에는 집안이 너무 덥지 않게 신경 쓰고 가능한 안정을 유지시킨다. 소형견이나 단두종에게 많은 질병이므로 그런 견종들은 비만을 개선해야 한다."
질병,기관지염케어방법|기관지염주의,"항생물질 외에 진해제, 거담제, 소염제 등을 투여한다. 필요에 따라 흡입요법을 하는 경우도 있다. 가정에서는 산책이나 운동은 피하고 안정시킨다. 목에 자극을 주지 않도록 보습, 환기에 신경 쓴다."
질병,폐렴케어방법|폐렴주의,"항생물질 외에 진핵제, 거담제, 소염제 등을 투여한다. 중증인 경우에는 산소흡입이 필요하다. 가정에서는 안정을 유지시키고, 공기의 환기나 온도에 신경 쓴다."
질병,폐수종케어방법|폐수종주의,호흡을 도와주는 산소흡입이나 폐에 고인 물기를 제거하기 위한 이뇨제 등을 투여한다. 염증이나 심장에 대한 약을 처방하기도 한다. 가정에서는 운동을 제한하고 안정을 유지시킨다. 식사는 염분과 나트륨을 삼간다.
질병,기흉케어방법|기흉주의,흉강에 쌓인 공기를 빼거나 산소를 흡입시킨다. 중증인 경우에는 개흉수술이 필요한 경우도 있다.
질병,횡격막헤르니아케어방법|횡격막헤르니아주의|헤르니아케어방법|헤르니아주의,증상이 심한 경우에는 신속하게 수술하여 파열부를 개복해야 한다. 개복하지 않는 경우에도 최종적으로는 수술로 치료하는 것이 일반적이다.
질병,흉막염케어방법|흉막염주의,침출액이 쌓여 있을 때에는 바늘로 흉강로 찔러 흡인해서 배출시킨다. 그 외의 감염증이라면 항생물질을 투여하는 등 원인을 치료한다.
질병,거대식도증케어방법|거대식도증주의,원인인 질병이 있는 경우에는 그것부터 치료한다. 완치가 어렵기 때문에 식사를 주는 방법에 대해 연구해서 토하는 것을 방지하도록 한다. 개를 세운 상태에서 개보다 높은 위치에서 유동식을 급여하고 가능한 식후에도 서 있는 상태를 유지시켜 음식물이 중력으로 식도를 이동하게 한다.
질병,식도내이물케어방법|식도내이물주의,이물질을 제거한다. 내시경을 삽입해 끄집어낸다. 식도절개는 가슴을 개복해야 하는 힘든 수술이므로 이물질을 위 속으로 밀어 넣을 수 있다면 위를 절개해서 꺼내는 방법을 선택한다. 특히 새끼 때에는 급여하는 내용물에 신경 써야 한다.
질병,급성위염케어방법|급성위염주의,증상이 가벼운 경우에는 하루 동안 식사를 제한하면 곧 회복된다. 이물질을 삼킨 경우에는 토해내게 해야 하는데 토해내지 않는다면 수술이 필요하다. 탈수증상이 있을 때에는 수액치료 등을 병행한다. 구토나 설사가 가라앉은 후에는 미지근한 물부터 주고 식사는 소화가 잘 되는 유동식을 준비한다.
질병,만성위염케어방법|만성위염주의,"원인이 확실하다면 그것부터 치료를 하고, 원인이 확실하지 않을 때에는 증상을 완화시키기 위해서 점막을 보호하는 약이나 구토를 멈추게 하는 약, 항생물질 등을 투여하고 식사요법을 병행하는 것이 일반적이다. 가정에서는 소화가 잘되는 식사를 조금씩 여러 차례에 나눠서 급여한다."
질병,위확장과위염전케어방법|위확장과위염전주의|위확장케어방법|위확장과위염전주의,위확장만 있는 경우에는 위 속의 가스를 제거하고 위를 세척한다. 위염전인 경우에는 신속하게 개복수술을 해야 한다. 위염전은 발견이 늦으면 대부분 사망하는 심각한 질병이다. 치료 후에는 일정 기간 동안 절식한다. 재발 방지를 위해 과식으로 위에 부담을 주지 않도록 식사는 소량으로 여러 차례에 나눠서 먹이고 식후에 물을 많이 먹지 못하게 한다. 또한 식후에 바로 운동을 하지 않게 한다.
질병,출혈성위장염케어방법|출혈성위장염주의,"탈수가 심하면 수액을 맞히고, 쇼크 증상이 있다면 그에 상응하는 치료를 한다. 구토나 설사가 없는 경우에는 식사와 물을 제한하고 세균의 2차 감염을 막기 위해서 항생물질 등을 투여한다."
질병,대장염케어방법|대장염주의,반나절에서 하루 정도 절식을 시켜 장을 쉬게 한다. 탈수증상이 심할 때에는 수액을 맞히거나 장 점막을 보호할 수 있도록 지사제를 투여한다. 원인이 되는 바이러스 감염증은 백신 접종으로 예방할 수 있다. 효과적으로 기생충을 예방하기 위해서는 정기적으로 분변검사를 해야 한다.
질병,흡수불량증후군케어방법|흡수불량증후군주의,원인이 되는 질병이 다양하므로 원인부터 밝혀 치료한다. 식사요법을 중심으로 하고 탈수증상이 심할 때에는 수액을 맞힌다.
질병,장폐색케어방법|장폐색주의,"탈수증상이나 쇼크 증상을 치료로 가라앉히고 상태가 안정된 후에는 한시라도 빨리 개복수술을 해야 한다. 치료 후에는 일정 기간 절식시킨 후 수분보급, 유동식 순으로 급여한다."
질병,급성간염케어방법|급성간염주의,수액을 맞히거나 해독제를 투여해서 응급처치를 한 후 충분한 휴식과 영양을 공급해 간 기능 회복을 촉진시킨다. 평소 고지방 식단을 피하고 양질의 단백질로 구성된 처방식을 주는 것이 좋다.
질병,췌염케어방법|췌염주의,단기간 절식을 시켜 췌장의 기능을 억제한다. 소화효소를 저해하는 약이나 진통제를 투여한다. 회복한 후에는 지방분이 많은 식사는 반드시 피해야 한다. 또 비만이 되지 않도록 주의하는 것도 중요하다.
질병,췌외분비부전케어방법|췌외분비부전주의,소화효소를 투여해서 보급하고 비타민 보충제 등으로 영양의 밸런스를 맞춰준다. 항생물질이나 스테로이드제를 처방하는 경우도 있다. 식사는 저지방으로 소화하기 쉬운 것을 조금씩 급여하도록 한다. 개가 과식을 하지 않도록 신경 쓴다.
질병,항문낭염케어방법|항문낭염주의,"항문낭에서 쌓여 있는 분비물을 손으로 짜낸다. 곪은 경우에는 항생물질을 투여한다. 분비물을 축적하는 속도(일수)는 개체 차이가 있다. 분비물이 잘 쌓이는 개의 경우 동물병원에서 지도를 받으면 가정에서도 짜내는 처치가 가능하지만, 심한 악취가 있어 의복 등에 묻으면 빠지지 않으므로 주의해야 한다. 빈번히 반복되는 경우나 심하게 쌓여서 손으로 짜내도 배출하지 못하는 경우에는 항문낭을 제거하는 방법도 있다."
질병,항문주위염항문주위루케어방법|항문주위염항문주위루주의,항문주위염은 외용약과 내복약을 병용하여 치료한다. 항문주위루는 누관을 만드는 조직이나 화농이 되어 있는 층을 수술로 제거한다. 예방을 위해서 항문 주위는 언제나 청결하도록 신경써준다.
질병,회음헤르니아케어방법|회음헤르니아주의,수술로 직장을 원래의 위치로 돌려놓고 탈출한 부위의 근육을 꿰맨다. 증상이 가벼우면 식이요법이나 변을 부드럽게 하는 약을 투여한다. 전립선 비대가 원인인 경우에는 중성화 수술을 하면 예방할 수 있다.
질병,소화기종양케어방법|소화기종양주의,"수술로 제거하거나 방사선 요법이나 항암제, 면역요법 등도 시도해볼 수 있다. 조기발견이 중요해서 빨리 치료하면 나을 확률이 크다. 위암이나 간장암은 꽤 커진 후에야 발견되는 경우가 많은데, CT나 MRI 등 사람과 마찬가지로 영상진단이 보급됨에 따라 복강 내의 종양을 조기 발견할 확률이 늘고 있다."
질병,급성신부전케어방법|급성신부전주의,"한시라도 빨리 병원으로 데려가야 한다. 병원에서는 긴급한 구급조치를 할 수 있다. 탈수증상을 일으키는 경우에는 수액을 맞히고, 결석이 원인인 경우에는 수술로 제거한다. 독극물이 원인일 때에는 토하게 하거나 중독에 대응하는 치료를 하여 신장에 가해지는 데미지를 줄여준다. 감염증일 때에는 항생물질 등의 약물 투여를 하는데, 신장에 부담이 적은 약제를 선택하는 것이 좋다. 증상이 안정된 뒤에도 만성이 되지 않도록 충분한 치료가 필요하다."
질병,만성신부전케어방법|만성신부전주의,"일단 나빠진 신장의 기능은 다시 회복되지 않고 계속 악화되기 때문에 치료는 최대한 증상을 완화시키는 것이 목적이다. 식사요법이나 약물 투여, 수액 등의 증상에 맞게 치료한다. 사람에게 실시하고 있는 인공투석이나 신장이식은 일부 특별한 시설에서만 가능하고 아직 일반적이지 않다. 장관 내에서 독소를 흡수하는 작용을 하는 카본계 내복약이나 신장병 전용 치료식을 주거나, 단백질이나 인, 나트륨을 삼간 식사요법으로 조금이라도 진행을 늦추고 좋은 상태를 유지시키는 예도 적지 않다."
질병,요독증케어방법|요독증주의,"수액을 맞히는 동시에 약물요법, 식사요법을 병행한다."
질병,사구체신염케어방법|사구체신염주의,"원인이 되는 질병이 판명되면, 그 질병을 치료한다. 그와 동시에 신부전을 치료한다."
질병,네프로제증후군신장증케어방법|네프로제증후군신장증주의,"원인이 되는 질병을 치료한다. 부종이 심한 경우에는 이뇨제를 투여한다. 거기에 맞춰 저단백, 저나트륨 식사요법을 실시하는데 단백질은 너무 제한하지 않도록 한다. 신장병용 치료식을 응용하는 것도 좋다."
질병,신우신염케어방법|신우신염주의,완치될 때까지 항생물질을 충분한 기간 동안 투여한다. 신부전으로 진행되고 있는 경우에는 그에 맞는 치료를 한다.
질병,방광염케어방법|방광염주의,항생물질이나 항균제 등을 장기 투여한다. 만성화되거나 재발하기 쉬운 질병이므로 한 번이라도 방광염에 걸렸던 적이 있다면 평소 주의를 기울이도록 한다. 식사에 신경을 쓰고 저항력이 떨어지지 않도록 건강 관리가 필수이다.
