종류,규칙,답변
질병,위확장과위염전|위확장|위염전," 증상] : 복부가 부풀어 올라 가라앉지 않고 고통스러워 보인다. 이따금 구토나 트림을 하고 침을 대량으로 흘리기도 한다. 또 위가 꼬인 위염전의 경우에는 토하려고 해도 토하지 못하고 침만 흘리면서 괴로워한다. 심한 통증 때문에 쇼크 상태에 빠지기도 한다.@ 원인] : 새끼가 과식했을 때나 성견이나 노견이 걸신들린 듯이 먹다가 위에 가스가 발생하고, 액체가 쌓여서 위가 빵빵해져 붓고 위확장이 된다. 이 상태에서 심한 운동 등을 하면 위가 꼬여서 위염전이 된다.@ 케어방법] : 위확장만 있는 경우에는 위 속의 가스를 제거하고 위를 세척한다. 위염전인 경우에는 신속하게 개복수술을 해야 한다. 위염전은 발견이 늦으면 대부분 사망하는 심각한 질병이다. 치료 후에는 일정 기간 동안 절식한다. 재발 방지를 위해 과식으로 위에 부담을 주지 않도록 식사는 소량으로 여러 차례에 나눠서 먹이고 식후에 물을 많이 먹지 못하게 한다. 또한 식후에 바로 운동을 하지 않게 한다."
질병,출혈성위장염," 증상] : 악취가 나는 잼 같은 암적색 피가 섞인 변이 나온다. 구토를 하거나 피를 토하며 탈수증상을 일으키거나 호흡이나 심박이 빨라져서 쇼크 증상을 일으킬 수가 있다. 슈나우저나 닥스훈트, 토이 푸들, 말티즈 등의 소형견에게서 발병하는 경향이 크다.@ 원인] : 파보바이러스 감염증과 같은 감염증 외에도 확실한 원인이 알려지지 않은 출혈성 위장염도 있으며 건강하게 보이는 개에게 갑자기 일어난다. 대부분 소형견들에게 발병한다.@ 케어방법] : 탈수가 심하면 수액을 맞히고, 쇼크 증상이 있다면 그에 상응하는 치료를 한다. 구토나 설사가 없는 경우에는 식사와 물을 제한하고 세균의 2차 감염을 막기 위해서 항생물질 등을 투여한다."
질병,대장염," 증상] : 수분을 흡수하는 대장에 염증이 번지기 때문에 장성 설사는 수분이 많아지고 선혈이나 점액이 섞인다. 탈수증상을 일으키기도 한다.@ 원인] : 바이러스나 세균, 기생충 감염, 식사, 약물, 스트레스 등 다양한 원인으로 인해 장에 염증이 발생한다.@ 케어방법] : 반나절에서 하루 정도 절식을 시켜 장을 쉬게 한다. 탈수증상이 심할 때에는 수액을 맞히거나 장 점막을 보호할 수 있도록 지사제를 투여한다. 원인이 되는 바이러스 감염증은 백신 접종으로 예방할 수 있다. 효과적으로 기생충을 예방하기 위해서는 정기적으로 분변검사를 해야 한다."
질병,흡수불량증후군," 증상] : 심해질 때까지는 기운도 있고 흡수하지 못하는 영양분을 보충하려고 하기 때문에 오히려 식욕이 왕성하기도 한데, 영양소의 대부분이 배설되기 때문에 변은 평소와 다른 상태가 계속된다. 곧이어 설사를 일으키게 되고 체중이 감소한다. 변이 부드럽고 기름기가 많이 섞여 나온다.@ 원인] : 소장의 점막에 이상이 있는 경우, 위장염이나 종양 등에 의해 점막에 상처가 난 경우, 장림프관의 확장증 등 다양한 원인이 있다.@ 케어방법] : 원인이 되는 질병이 다양하므로 원인부터 밝혀 치료한다. 식사요법을 중심으로 하고 탈수증상이 심할 때에는 수액을 맞힌다."
질병,장폐색," 증상] : 음식물이 역류해서 심하게 구토를 하고 장이 확장되어 통증도 생긴다. 식욕이나 기운이 없어지고 설사를 일으키기도 한다. 장이 완전히 막혀버리면 복통이 심해지고, 체내에서의 수분대사도 저하되어 신장장애나 쇼크 증상 등 더 심각한 증상이 나타난다.@ 원인] : 돌이나 구슬 같은 장난감이나 이물질을 삼켜서 장이 막히는 케이스가 많다. 작은 돌멩이나 비닐, 실뭉치 등이 조금씩 쌓여서 막히는 경우도 있다. 또 종양이나 장염, 장염전, 장중적 등의 질병이 원인일 수도 있다.@ 케어방법] : 탈수증상이나 쇼크 증상을 치료로 가라앉히고 상태가 안정된 후에는 한시라도 빨리 개복수술을 해야 한다. 치료 후에는 일정 기간 절식시킨 후 수분보급, 유동식 순으로 급여한다."
질병,급성간염," 증상] : 구토나 설사를 일으키고 식욕이나 기운이 없어진다. 중증인 경우에는 눈이나 입이나 피부색이 노랗게 되는 황달이나 경련, 근력이 떨어져 비틀거리는 등의 증상이 나타난다. 의식이 혼탁해지거나 혼수상태가 되는 등의 신경증상이 나타나기도 한다. 만성 간염에서는 눈에 띄는 증상이 나타나지 않다가 질병이 상당히 진행된 후에야 배에 복수가 차거나 마르는 등의 증상을 보여 알게 되는 경우가 많다.@ 원인] : 동, 비소, 수은, 클로로포름 등의 중독 외에 진통제, 마취제, 이뇨제 등의 약물이 원인이 되기도 한다. 또 바이러스나 진균에 의해 감염성 간염, 기생충성 간염 등 다양한 원인이 알려져 있다.@ 케어방법] : 수액을 맞히거나 해독제를 투여해서 응급처치를 한 후 충분한 휴식과 영양을 공급해 간 기능 회복을 촉진시킨다. 평소 고지방 식단을 피하고 양질의 단백질로 구성된 처방식을 주는 것이 좋다."
질병,췌염," 증상] : 식욕부진으로 구토와 설사를 반복한다. 설사는 출혈성인 경우도 있다. 중증인 경우에는 격통 때문에 쇼크 증상을 일으켜 사망에 이르기도 한다. 또 만성 췌염에서는 증상이 크게 나타나기 전에 질병이 진행된다.@ 원인] : 고지방에 치우친 식사를 원인 중 하나로 보고 있다. 또 비만인 개도 쉽게 발병하는 경향이 있다. 그 외에 약물이나 감염, 외상, 바이러스나 기생충 등 많은 원인이 있다.@ 케어방법] : 단기간 절식을 시켜 췌장의 기능을 억제한다. 소화효소를 저해하는 약이나 진통제를 투여한다. 회복한 후에는 지방분이 많은 식사는 반드시 피해야 한다. 또 비만이 되지 않도록 주의하는 것도 중요하다."
질병,췌외분비부전, 증상] : 항상 허겁지겁 많이 먹는데도 불구하고 체중이 늘지 않고 마른다. 악취가 나는 지방성 변을 다량으로 보는 것도 특징이다. 설사도 자주 일으킨다.@ 원인] : 췌염 등의 원인으로 소화효소 분비가 부족하기 때문에 췌장에서 효소를 받아들이는 소장은 영양을 흡수하지 못하게 된다. 최근에는 바이러스 등을 공격하는 면역이 자신의 조직을 공격하게 되는 자기면역질환으로 보고 있다.@ 케어방법] : 소화효소를 투여해서 보급하고 비타민 보충제 등으로 영양의 밸런스를 맞춰준다. 항생물질이나 스테로이드제를 처방하는 경우도 있다. 식사는 저지방으로 소화하기 쉬운 것을 조금씩 급여하도록 한다. 개가 과식을 하지 않도록 신경 쓴다.
질병,항문낭염," 증상] : 항문부위를 바닥에 끌거나 핥는다. 심하면 염증 때문에 항문낭이 붓고, 배변 시 통증 때문에 비명을 지르기도 한다.@ 원인] : 세균감염에 의해 항문낭이 염증을 일으킨다. 파열되어 분비물과 함께 고름이나 피가 나오는 경우도 있다.@ 케어방법] : 항문낭에서 쌓여 있는 분비물을 손으로 짜낸다. 곪은 경우에는 항생물질을 투여한다. 분비물을 축적하는 속도(일수)는 개체 차이가 있다. 분비물이 잘 쌓이는 개의 경우 동물병원에서 지도를 받으면 가정에서도 짜내는 처치가 가능하지만, 심한 악취가 있어 의복 등에 묻으면 빠지지 않으므로 주의해야 한다. 빈번히 반복되는 경우나 심하게 쌓여서 손으로 짜내도 배출하지 못하는 경우에는 항문낭을 제거하는 방법도 있다."
질병,항문주위염항문주위루, 증상] : 가려움이나 통증 등의 불쾌감 때문에 항문 주변을 핥거나 깨물어서 염증이 일어난다. 배변을 힘들어 한다. 항문주위루에서는 배변 시 출혈이나 농상의 분비물이 보인다.@ 원인] : 항문 주위의 항문선에 생긴 염증 때문에 개가 가려움이나 통증을 느끼고 그것을 핥거나 깨물면 항문주위염이 일어난다. 항문주위루는 항문선이 감염되면서 화농화되는 것으로 보인다.@ 케어방법] : 항문주위염은 외용약과 내복약을 병용하여 치료한다. 항문주위루는 누관을 만드는 조직이나 화농이 되어 있는 층을 수술로 제거한다. 예방을 위해서 항문 주위는 언제나 청결하도록 신경써준다.
질병,회음헤르니아," 증상] : 항문 한쪽 또는 양쪽이 크게 부풀어 오른다. 방광을 압박해서 배뇨가 곤란해지거나 튀어나온 직장이 굴곡져 있기 때문에 변의 이동이 부드럽지 않아 변비에 걸린다.@ 원인] : 나이가 들면서 근력이 약해지거나 호르몬의 불균형, 만성 변비, 전립선 비대 등이 원인으로 보인다.@ 케어방법] : 수술로 직장을 원래의 위치로 돌려놓고 탈출한 부위의 근육을 꿰맨다. 증상이 가벼우면 식이요법이나 변을 부드럽게 하는 약을 투여한다. 전립선 비대가 원인인 경우에는 중성화 수술을 하면 예방할 수 있다."
질병,소화기종양," 증상] : 질병이 상당히 진행될 때까지 증상이 나타나지 않는 경우도 많고 종양이 생긴 위치에 따라 증상이 다양하다. 일반적으로는 기운이 없어지고 체중이 감소하며 구토나 설사를 하고 배가 부풀어 오르는 등의 증상이 나타난다.@ 원인] : 유전에 후천적인 요소가 더해져 발병한다.@ 케어방법] : 수술로 제거하거나 방사선 요법이나 항암제, 면역요법 등도 시도해볼 수 있다. 조기발견이 중요해서 빨리 치료하면 나을 확률이 크다. 위암이나 간장암은 꽤 커진 후에야 발견되는 경우가 많은데, CT나 MRI 등 사람과 마찬가지로 영상진단이 보급됨에 따라 복강 내의 종양을 조기 발견할 확률이 늘고 있다."
질병,급성신부전," 증상] : 갑자기 기운이나 식욕이 완전히 사라진다. 이렇게 되기 전까지 다음, 다뇨 등의 증상을 보이다가 소변양이 적어지고, 어느 순간 전혀 나오지 않게 된다. 구토, 설사 등의 증상이 나타나고, 입이 바싹 마를 정도로 심한 탈수증상을 보이기도 한다. 체내에 독소가 쌓이면 요독증을 일으키고 경련 등의 신경증상이 나타난다. 사망률이 높고 만성 신부전으로 차츰 전이된다.@ 원인] : 급성 신부전은 원인이 어디에 있는지에 따라서 신전성, 신성, 신후성으로 나눌 수 있다. 신전성은 심장의 질병 등이 원인이 되어 신장으로 가는 혈액의 양이 줄어들어 발병한다. 신성은 신장 자체에 장애가 있는 타입으로 독성을 섭취하거나 외상, 감염증, 종양 등 다양한 원인이 있다. 신후성은 신장보다 뒤에 있는 기관인 방광이나 요도에 결석 등이 생겨 소변이 제대로 배설되지 못해서 발생한다.@ 케어방법] : 한시라도 빨리 병원으로 데려가야 한다. 병원에서는 긴급한 구급조치를 할 수 있다. 탈수증상을 일으키는 경우에는 수액을 맞히고, 결석이 원인인 경우에는 수술로 제거한다. 독극물이 원인일 때에는 토하게 하거나 중독에 대응하는 치료를 하여 신장에 가해지는 데미지를 줄여준다. 감염증일 때에는 항생물질 등의 약물 투여를 하는데, 신장에 부담이 적은 약제를 선택하는 것이 좋다. 증상이 안정된 뒤에도 만성이 되지 않도록 충분한 치료가 필요하다."
질병,만성신부전," 증상] : 수년에 걸쳐 질병이 진행되어 확실한 증상이 나타날 때까지 시간이 걸린다. 색이 옅은 소변을 다량으로 보게 되고(다뇨), 수분을 보충하기 위해서 다량의 물을 마시게(다음) 된다. 차츰 식욕이 저하되고 모질이 나빠지며 마르기 시작한다. 이따금 구토를 하거나 빈혈을 일으키기도 한다. 나른해 보이고 기운이 없으며 말기에는 경련이나 혼수상태 등의 증상이 엿보이기도 한다.@ 원인] : 원인은 혈액을 여과시키는 사구체의 염증, 선천적인 염증 등 다양하다. 급성 신부전이 이행하는 경우도 있다.@ 케어방법] : 일단 나빠진 신장의 기능은 다시 회복되지 않고 계속 악화되기 때문에 치료는 최대한 증상을 완화시키는 것이 목적이다. 식사요법이나 약물 투여, 수액 등의 증상에 맞게 치료한다. 사람에게 실시하고 있는 인공투석이나 신장이식은 일부 특별한 시설에서만 가능하고 아직 일반적이지 않다. 장관 내에서 독소를 흡수하는 작용을 하는 카본계 내복약이나 신장병 전용 치료식을 주거나, 단백질이나 인, 나트륨을 삼간 식사요법으로 조금이라도 진행을 늦추고 좋은 상태를 유지시키는 예도 적지 않다."
질병,요독증," 증상] : 기운, 식욕이 없어지고 구토나 설사, 빈혈 등을 일으킨다. 암모니아 냄새가 섞인 구취가 나는 경우도 있다. 체중 감소와 함께 모질이 나빠지고 빈혈, 부정맥, 경련, 혼수상태 등 다양한 증상이 나타난다.@ 원인] : 신부전증이 진행되면서 체내에 독소가 축적되어 일어난다.@ 케어방법] : 수액을 맞히는 동시에 약물요법, 식사요법을 병행한다."
질병,사구체신염," 증상] : 급성인 경우는 급성 신부전의 증상이, 만성인 경우에는 만성 신부전의 증상이 나타난다. 단 다른 질병에 걸렸을 때 일어나는 경우도 많은데, 이 경우에는 원인이 되는 질병에 따라 증상이 다양하다.@ 원인] : 바이러스 감염이나 기생충, 용혈성 빈혈, 종양, 췌장염 등 다양한 원인에 의해 몸의 면역기구에 이상이 일어나 발병하는 것으로 보인다. 또 유전적으로 걸리기 쉬운 견종도 있는 것으로 보인다.@ 케어방법] : 원인이 되는 질병이 판명되면, 그 질병을 치료한다. 그와 동시에 신부전을 치료한다."
질병,네프로제증후군신장증|네프로제," 증상] : 몸이나 다리가 붓거나 배에 물이 고이는 복수 등의 증상이 나타난다. 단백뇨가 나오거나 혈액 중의 콜레스테롤이 증가한다. 위험한 요독증으로 이행되는 경우도 적지 않다.@ 원인] : 사구체신염이나 신아미로이드시스라는 질병이 주요 원인이다. 단백질이 소변으로 새어 나와 혈중 단백질이 감소하고 혈관에서 수분이 체내로 새어 부종이 생기거나 복수가 차게 된다.@ 케어방법] : 원인이 되는 질병을 치료한다. 부종이 심한 경우에는 이뇨제를 투여한다. 거기에 맞춰 저단백, 저나트륨 식사요법을 실시하는데 단백질은 너무 제한하지 않도록 한다. 신장병용 치료식을 응용하는 것도 좋다."
질병,신우신염," 증상] : 급성인 경우와 만성인 경우가 있다. 급성인 경우에는 발열을 하거나 구토, 식욕부진 등과 같은 증상이 나타나고 방광염과 비슷한 증상을 보인다. 만성인 경우에는 물을 많이 마시고 소변양이 증가하는(다음, 다뇨) 외에 아무런 증상이 없기 때문에 염증이 번져 신부전이 될 때까지 알아차리지 못하는 경우도 적지 않다.@ 원인] : 소변은 신우, 요관, 방광, 요도 순으로 흐르는데, 신우보다 아래쪽에 감염 세균이 올라와서 일어난다.@ 케어방법] : 완치될 때까지 항생물질을 충분한 기간 동안 투여한다. 신부전으로 진행되고 있는 경우에는 그에 맞는 치료를 한다."
질병,방광염," 증상] : 다음, 다뇨의 증상이 보인다. 소변 보는 포즈를 자주 취하지만 나오지 않는 경우도 있다. 소변은 탁하거나 색이 진하며, 정상일 때에 비해 냄새가 강하게 나기도 한다. 발열하는 경우도 있고, 식욕이 떨어지고 기운이 없어지기도 한다.@ 원인] : 대장균, 포도구균 등의 세균이 요도로 침입해 방광에 감염되어 염증을 일으킨다. 대부분의 경우에 만성화되고 염증이 번져 요로를 거슬러 올라가 신우신염을 일으키기도 한다. 간혹 추위나 스트레스도 원인이 되는 경우가 있다.@ 케어방법] : 항생물질이나 항균제 등을 장기 투여한다. 만성화되거나 재발하기 쉬운 질병이므로 한 번이라도 방광염에 걸렸던 적이 있다면 평소 주의를 기울이도록 한다. 식사에 신경을 쓰고 저항력이 떨어지지 않도록 건강 관리가 필수이다."
질병,요로결석증," 증상] : 혈뇨가 나오거나 소변 횟수가 많아지거나 적어지는 등 소변에 이상이 생긴다. 결석이 완전히 막혀버리면 배뇨 포즈를 취해도 전혀 나오지 않게 된다. 가장 많은 방광결석의 경우에는 빈뇨가 되거나 소변을 잘 못 보는 경우가 많지만 증상이 없는 경우도 있다. 소형견에서는 큰 결석이 생기면 방광 근처를 만졌을 때 단단한 응어리가 느껴지기도 한다. 요도결석은 요도가 긴 수컷에게 많고 혈뇨, 배뇨곤란, 뇨폐색 외에 소변을 볼 때마다 통증을 일으키기도 하고 갑자기 중독증을 일으키기도 한다.@ 원인] : 결석은 핵이 되는 세균 등에 소변 속의 성분이 달라붙어 생긴다. 종류는 다양한데 견종에 따라 생성되기 쉬운 결석이 다르다. 대부분 방광에서 생성되고, 배뇨 시 요도로 이동해 부진결석이 된다. 또 신장에서 만들어진 것은 윤뇨관으로 이동하여 요관결석이 된다. 어느 쪽이든 완전히 요로를 막아버리면 다양한 증상이 일어난다.@ 케어방법] : 결석의 종류에 따라 식이요법으로 녹일 수 있는 것도 있다. 대부분 세균에 감염되어 있기 때문에 항생물질을 투여한다. 결석이 요로를 막아버린 경우에는 가능한 빨리 수술로 제거해야 한다. 요도에 박힌 결석은 최대한 방광 안까지 밀어 올려서 적출하고 가능한 요도절개까지는 피한다. 결석을 제거한 후에는 재발 방지를 위해 반드시 식이요법을 해야 한다."
질병,간질," 증상] : 갑자기 사지가 경직되면서 경련을 일으키고 의식을 잃고 쓰러진다. 증상 정도에 따라 입에서 거품이 끓어오르거나 호흡곤란을 일으키고 대변이나 소변을 지리기도 한다. 발작은 수십 초 정도 후에 가라앉으면서 마치 아무 일도 없었던 듯한 모습을 보이지만, 간혹 발작 후에 이상한 식욕을 보이거나 물을 대량으로 들이키거나 혼수상태가 되기도 한다. 발작이 몇 차례 반복되는 경우라면 생명에 지장이 있을 수도 있으므로 서둘러 수의사에게 문의하도록 한다.@ 원인] : 뇌의 신경세포에 변화가 일어나고 긴장상태가 되면서 발생한다. 선천적으로 뇌에 이상이 있는 경우나 뇌의 염증, 종양, 외상 등이 원인이 되는 경우도 있다. 또 과도한 정신적 스트레스 등이 뇌에 영향을 미쳐서 발병하기도 한다.@ 케어방법] : 항간질제를 응용하면 발작을 억제할 수 있다. 증상이나 일반검사로 원인을 조사할 수 있는데 CT나 MRI 검사 등을 하면 변병부를 특정할 수도 있다. 발작이 언제 어떤 상황에서 일어났는지 기록해두고 원인을 알아본다. 발작 중에 소란을 피우면 혼란에 빠진 개가 물 수도 있으니 버둥거리는 개가 다치지 않도록 주인은 침착하게 대처해야 한다."
질병,전정장애, 증상] : 갑자기 증상이 나타나는 경우가 많고 고개가 기울어진 상태인 것이 특징이다. 눈이 부자연스럽게 파르르 떨리는 경우도 있다. 평형감각을 잃었기 때문에 심해지면 밥도 제대로 먹지 못하게 된다.@ 원인] : 귀 속에 있는 내이의 종양이나 염증이 원인이다. 또 나이가 원인인 경우도 있는데 노견에게 많이 발병하는 경향이 있다.@ 케어방법] : 항생물질이나 스테로이드제를 투여하고 적절한 치료를 하면 며칠에서 몇 주 사이에 병상을 개선할 수 있다. 후유증으로 고개가 기울어진 상태가 지속되기도 하므로 이상이 보이면 조기에 진찰받도록 한다.
질병,수두증," 증상] : 평소처럼 걷지 못하게 되는 등의 운동장애나 의식장애가 발생한다. 일상적인 행동에 이상이 발생하여 동작이 완만해지거나 반대로 쉽게 흥분한다, 난폭해진다, 잠만 잔다, 치매가 보인다 등의 증상이 나타난다. 경련 발작을 일으키기도 한다.@ 원인] : 유전적으로 발병하는 예로는 일반적으로 두부가 크고 두 개의 두정골의 발달이 미숙해서 선문이 완전히 닫혀 있지 않은 예가 많이 접수되고 있다. 뇌척수는 일정량이 뇌의 내부를 순환하고 있는데, 그 흐름이 막혔거나 이상이 많아져서 뇌압이 높아진다. 후천적으로는 바이러스 감염이 원인이 되는 것으로 알려져 있다.@ 케어방법] : 뇌압강하약을 사용하거나 체내의 수분을 줄이기 위해 이뇨제를 투여한다. 고인 체액을 배출하는 수술도 있지만 일반적으로는 하지 않는다. 치료를 한다고 반드시 살릴 수 있다고는 할 수 없는 질병이다."
질병,저혈당증," 증상] : 몸에 힘이 들어가지 않고 기운을 잃거나 축 늘어져 보인다. 증상이 심해지면 호흡이 거칠어지고 경련발작을 일으키거나 하반신이 마비되거나 혼수상태에 빠지기도 한다.@ 원인] : 새끼 때에는 이유 직후의 환경 변화나 스트레스, 몸의 냉기나 굶주림, 소화기의 이상에 의해 발생한다. 성견이나 노견 등은 혈당치를 컨트롤하는 인슐린 호르몬이 과잉으로 분비되어 발병한다. 공복 시나 운동으로 당분이 부족했을 때에도 일어나는 경우가 있다.@ 케어방법] : 포도당을 주입하여 치료한다. 가정에서의 처치로는 적절한 식사를 주는 것이다. 당분을 주는 것도 한 방법이다."
질병,안면신경마비," 증상] : 양쪽 얼굴 중 한 곳에 일어나는 경우가 많고 눈꺼풀이나 입술, 귀 등의 근육에 힘이 들어가지 않아서 처지기 때문에 눈물이나 침이 흘러내린다. 대부분은 1~2개월 정도 지나면 회복되는데 그 이상 경과해도 낫지 않고 지속되는 경우도 있다. 눈이 감기지 않게 되거나 건조성 각막염 등의 안질환을 일으키기도 한다.@ 원인] : 대부분 원인이 밝혀지지 않았지만 갑상선의 기능 저하나 중이염, 내이염, 안면신경 외상 등이 원인이 되는 경우가 있다.@ 케어방법] : 신경의 염증을 가라앉히거나 혈류를 좋게 하는 약을 투여한다. 치료는 원인에 따라 다르지만, 불명인 경우에는 회복이 어려워지기도 한다. 마비의 악화나 후유증을 막기 위해서는 조기치료가 중요하다."
질병,추간판헤르니아," 증상] : 특히 등줄기를 따라 심한 통증이 있어서 걷는 모습이나 자세가 이상하고, 등을 만지면 아파하며, 안으려고 하면 싫어하기도 한다. 악화되면 하반신이 마비되어 앞다리로만 걷게 되고, 통각도 마비되기 때문에 꼬집어도 반응하지 않는다. 이러한 증상이 나타난 경우에는 중증이어서 적절한 처치를 하지 않으면 평생 걷지 못하게 될 수 있다.@ 원인] : 닥스훈트나 코기처럼 동체가 긴 견종은 등의 부담이 크기 때문에 발생하기 쉬우며, 그 외에 비글, 시추, 페키니즈 등에게서도 흔히 볼 수 있다. 너무 마르거나 비만이거나 노화, 과격한 운동 등이 원인이 되기도 한다.@ 케어방법] : 안정을 취하고 평소 스테로이드제나 레이저 치료 등으로 통증을 완화하는데, 병변 부위에 특수한 약제를 주입하는 방법이 실시되기도 한다. 증상이 심한 경우에는 수술로 환부를 도려낸다. 평소 체중을 관리하고, 근육이 쇠퇴하지 않도록 하는 것이 예방방법이다. 특히 발병하기 쉬운 견종을 기르는 경우에는 등뼈에 충격을 주는 과격한 운동은 삼간다."
